{
  "schema_version": "0.2.0",
  "feed_id": "country_profile",
  "last_updated": "2026-08-12T17:52:01+09:00",
  "source": {
    "label": "P1-I static + IMF AREAER (curated) + OECD CRC + NEXI Category",
    "url": "https://www.elibrary-areaer.imf.org/",
    "disclaimer_ja": "P1-I attributes（fatf/epa等）⚠️静的。AREAER規制フラグ⚠️ curated。資本開放度 KAOPEN ✅（Chinn-Ito／AREAER由来）。為替レジーム IRR coarse ✅（〜2019年末）。OECD CRC / NEXI ✅公式表（semi-annual manual refresh）。iia_japan_bit / social_security_employer_rate_pct は stub null。"
  },
  "meta": {
    "iso2_list": [
      "AE",
      "AU",
      "BR",
      "CA",
      "CL",
      "CN",
      "CZ",
      "DE",
      "EG",
      "ES",
      "FR",
      "GB",
      "HK",
      "ID",
      "IE",
      "IN",
      "IT",
      "JP",
      "KE",
      "KR",
      "MX",
      "MY",
      "NL",
      "NZ",
      "PH",
      "PL",
      "SA",
      "SE",
      "SG",
      "TH",
      "TR",
      "TW",
      "US",
      "VN",
      "ZA"
    ],
    "country_count": 35,
    "p1i_attr_obs_count": 280,
    "regulation_categories": [
      "current_account_restrictions",
      "dividend_repatriation",
      "capital_fdi",
      "capital_real_estate",
      "capital_securities",
      "multiple_exchange_rates",
      "export_proceeds_surrender",
      "capital_outward",
      "money_market_instruments",
      "liquidating_proceeds",
      "guarantees_financial_backup",
      "personal_capital_movements"
    ],
    "regulation_year_range": {
      "from": 2025,
      "to": 2025
    },
    "oecd_crc_as_of": "2026-06-26",
    "nexi_category_as_of": "2026-07-06",
    "stubs": [
      "iia_japan_bit",
      "social_security_employer_rate_pct"
    ],
    "update_cadence": {
      "p1i_attributes": "annual manual",
      "areaer": "annual curated flags + auto KAOPEN/IRR companions",
      "oecd_crc": "semi-annual manual refresh",
      "nexi_category": "semi-annual manual refresh"
    },
    "wave_ab_added": {
      "as_of": "2026-08-12",
      "req": "REQ-SMITH-20260812-073",
      "iso2": [
        "AU",
        "MX",
        "ES",
        "IT",
        "NL",
        "PL",
        "ZA",
        "NZ",
        "CL",
        "KE",
        "EG",
        "IE",
        "SE",
        "CZ"
      ],
      "note": "Wave A+B curated profiles. KAOPEN/IRR/AREAER flags: stub or provisional open."
    }
  },
  "countries": [
    {
      "iso2": "AE",
      "iso3": "ARE",
      "name_ja": "UAE",
      "name_en": "United Arab Emirates",
      "region": "middle_east",
      "currency": "AED",
      "attributes": {
        "fatf_status": {
          "value": "normal",
          "source_ref": "FATF Jurisdictions under Increased Monitoring / Call for Action (as of 2026-06-19)",
          "veritas": "⚠️",
          "retrieved_at": "2026-07-13"
        },
        "japan_epa": {
          "value": false,
          "source_ref": "MOFA/METI/JETRO EPA・FTA発効一覧（二国間+RCEP/CPTPP/日EU/日英）",
          "veritas": "⚠️",
          "retrieved_at": "2026-07-13"
        },
        "japan_tax_treaty": {
          "value": true,
          "source_ref": "MOF 我が国の租税条約等の一覧 https://www.mof.go.jp/tax_policy/summary/international/tax_convention/",
          "veritas": "⚠️",
          "retrieved_at": "2026-07-13"
        },
        "japan_visa_free": {
          "value": true,
          "source_ref": "MOFA 査証免除措置（短期滞在）／各国入国要件ベストエフォート",
          "veritas": "⚠️",
          "retrieved_at": "2026-07-13"
        },
        "mofa_risk_level": {
          "value": 1,
          "source_ref": "MOFA 海外安全ホームページ 危険情報（国代表値・非ライブ）",
          "veritas": "⚠️",
          "retrieved_at": "2026-07-13"
        },
        "timezone_offset_jst": {
          "value": -5,
          "source_ref": "IANA / 標準時オフセット（JST=UTC+9基準、DST非反映）",
          "veritas": "⚠️",
          "retrieved_at": "2026-07-13"
        },
        "language_business": {
          "value": "Arabic / English",
          "source_ref": "静的キュレーション（ビジネス通用言語）",
          "veritas": "⚠️",
          "retrieved_at": "2026-07-13"
        },
        "msci_classification": {
          "value": "emerging",
          "source_ref": "MSCI Market Classification (Developed / Emerging / Frontier)",
          "veritas": "⚠️",
          "retrieved_at": "2026-07-13"
        }
      },
      "regulation": {
        "year": 2025,
        "source_ref": "IMF AREAER Online (curated static) | https://www.elibrary-areaer.imf.org/",
        "veritas": "⚠️",
        "note": "経常・資本とも比較的自由。フリーゾーン実務差あり。",
        "flags": {
          "current_account_restrictions": false,
          "dividend_repatriation": false,
          "capital_fdi": false,
          "capital_real_estate": true,
          "capital_securities": false,
          "multiple_exchange_rates": false,
          "export_proceeds_surrender": false,
          "capital_outward": false,
          "money_market_instruments": false,
          "liquidating_proceeds": false,
          "guarantees_financial_backup": false,
          "personal_capital_movements": false
        },
        "capital_openness_kaopen": {
          "value": 1.0,
          "year": 2023,
          "unit": "index_0_1",
          "veritas": "✅",
          "source_ref": "Chinn-Ito:kaopen_2023.xls:ka_open",
          "note": "Chinn-Ito KAOPEN（AREAER由来・資本取引開放度）。flags は curated 補完。"
        },
        "exchange_regime_irr_coarse": {
          "value": 1.0,
          "year": 2019,
          "unit": "code_1_6",
          "veritas": "✅",
          "source_ref": "IRR:ERA_Classification_Monthly:Coarse:year_end",
          "note": "IRR coarse de facto regime（1 peg … 6 dual/missing）。資本規制フラグとは別軸。"
        }
      },
      "oecd_crc": {
        "value": 2,
        "previous": 2,
        "as_of": "2026-06-26",
        "veritas": "✅",
        "source_ref": "OECD Country Risk Classification (Participants to the Arrangement) | https://www.oecd.org/en/topics/sub-issues/country-risk-classification.html",
        "note": null
      },
      "nexi_category": {
        "value": "C",
        "as_of": "2026-07-06",
        "veritas": "✅",
        "source_ref": "NEXI Country/Region Category | https://www.nexi.go.jp/cover/en/categorytable",
        "note": null
      },
      "iia_japan_bit": {
        "value": null,
        "veritas": "⚠️",
        "status": "stub",
        "upgrade_path": "UNCTAD IIA Navigator — 対日BIT/EPA投資章の有無を年1手動更新（REQ-010 P1-W）",
        "source_ref": "https://investmentpolicy.unctad.org/international-investment-agreements"
      },
      "social_security_employer_rate_pct": {
        "value": null,
        "unit": "%",
        "veritas": "⚠️",
        "status": "stub",
        "upgrade_path": "SSA Social Security Programs Throughout the World + PwC Tax Summaries 突合（REQ-010 P1-X）",
        "source_ref": "https://www.ssa.gov/policy/docs/progdesc/ssptw/"
      }
    },
    {
      "iso2": "AU",
      "iso3": "AUS",
      "name_ja": "オーストラリア",
      "name_en": "Australia",
      "region": "oceania",
      "currency": "AUD",
      "attributes": {
        "fatf_status": {
          "value": "normal",
          "source_ref": "FATF Jurisdictions under Increased Monitoring / Call for Action (as of 2026-06-19) | https://www.fatf-gafi.org/en/publications/High-risk-and-other-monitored-jurisdictions/increased-monitoring-june-2026.html",
          "veritas": "⚠️",
          "retrieved_at": "2026-08-12"
        },
        "japan_epa": {
          "value": true,
          "source_ref": "MOFA EPA/FTA in force | https://www.mofa.go.jp/policy/economy/fta/index.html",
          "veritas": "⚠️",
          "retrieved_at": "2026-08-12",
          "year": 2015
        },
        "japan_tax_treaty": {
          "value": true,
          "source_ref": "MOF 我が国の租税条約等の一覧 https://www.mof.go.jp/tax_policy/summary/international/tax_convention/",
          "veritas": "⚠️",
          "retrieved_at": "2026-08-12"
        },
        "japan_visa_free": {
          "value": true,
          "source_ref": "MOFA 査証免除措置（短期滞在・外国人が日本入国） https://www.mofa.go.jp/j_info/visit/visa/short/novisa.html",
          "veritas": "⚠️",
          "retrieved_at": "2026-08-12"
        },
        "mofa_risk_level": {
          "value": 1,
          "source_ref": "MOFA 海外安全ホームページ 危険情報（国代表値・非ライブ） https://www.anzen.mofa.go.jp/",
          "veritas": "⚠️",
          "retrieved_at": "2026-08-12"
        },
        "timezone_offset_jst": {
          "value": 1,
          "source_ref": "IANA / 標準時オフセット（JST=UTC+9基準、DST非反映）",
          "veritas": "⚠️",
          "retrieved_at": "2026-08-12"
        },
        "language_business": {
          "value": "English",
          "source_ref": "静的キュレーション（ビジネス通用言語）",
          "veritas": "⚠️",
          "retrieved_at": "2026-08-12"
        },
        "msci_classification": {
          "value": "developed",
          "source_ref": "MSCI Market Classification (Developed / Emerging / Frontier) | https://www.msci.com/market-classification",
          "veritas": "⚠️",
          "retrieved_at": "2026-08-12"
        }
      },
      "regulation": {
        "year": 2025,
        "source_ref": "IMF AREAER Online (curated static) | https://www.elibrary-areaer.imf.org/",
        "veritas": "⚠️",
        "note": "先進国型の開放的な資本・経常取引。FIRB等の投資審査は安全保障・国益枠。（AREAER flags は開放パターン仮置き・行突合待ち）",
        "flags": {
          "current_account_restrictions": false,
          "dividend_repatriation": false,
          "capital_fdi": false,
          "capital_real_estate": false,
          "capital_securities": false,
          "multiple_exchange_rates": false,
          "export_proceeds_surrender": false,
          "capital_outward": false,
          "money_market_instruments": false,
          "liquidating_proceeds": false,
          "guarantees_financial_backup": false,
          "personal_capital_movements": false
        },
        "capital_openness_kaopen": {
          "value": null,
          "year": 2023,
          "unit": "index_0_1",
          "veritas": "⚠️",
          "status": "stub",
          "source_ref": "Chinn-Ito:kaopen_2023.xls:ka_open",